{
  "version": "1.0.3",
  "name": "yolo26n-seg",
  "modelFile": "yolo26n-seg.onnx",
  "dynamicOutput": false,
  "contentType": "instanceSegmentation",
  "inputTensors": [
    {
      "shape": [1, 3, 640, 640],
      "dataKind": "ImageRgbChw",
      "valueType": "Float32",
      "keepAspectRatio": true,
      "letterboxRed": 0.4470588235294118,
      "letterboxGreen": 0.4470588235294118,
      "letterboxBlue": 0.4470588235294118
    }
  ],
  "outputTensors": [
    {
      "shape": [1, 300, 38],
      "dataKind": "RawTensorData",
      "valueType": "Float32"
    },
    {
      "shape": [1, 32, 160, 160],
      "dataKind": "RawTensorData",
      "valueType": "Float32"
    }
  ]
}
