{
  "version": "1.0.0",
  "name": "yolo26n-320-fp32-mlwl",
  "modelFile": "yolo26n-320.vgf",
  "dynamicOutput": false,
  "contentType": "genericObject",
  "inputTensors": [{
    "shape": [1, 3, 320, 320],
    "dataKind": "ImageRgbChw",
    "valueType": "Float32",
    "keepAspectRatio": true,
    "letterboxRed": 0.4470588235294118,
    "letterboxGreen": 0.4470588235294118,
    "letterboxBlue": 0.4470588235294118
  }],
  "outputTensors": [{"shape": [1, 2100, 84], "dataKind": "RawTensorData", "valueType": "Float32"}]
}
