{
  "version": "1.0.0",
  "name": "ultraface-rfb-320-fp32-mlwl",
  "modelFile": "ultraface-rfb-320.vgf",
  "dynamicOutput": false,
  "contentType": "humanFace",
  "inputTensors": [{
    "shape": [1, 3, 240, 320],
    "dataKind": "ImageRgbChw",
    "valueType": "Float32",
    "mean": [0.4980392156862745, 0.4980392156862745, 0.4980392156862745],
    "std": [0.5019607843137255, 0.5019607843137255, 0.5019607843137255]
  }],
  "outputTensors": [
    {"shape": [1, 4420, 2], "dataKind": "RawTensorData", "valueType": "Float32"},
    {"shape": [1, 4420, 4], "dataKind": "RawTensorData", "valueType": "Float32"}
  ]
}
