{
	"version": "1.0.0",
	"name": "yolox",
	"modelFile": "yolox_nano.pte",
	"dynamicOutput": true,
	"inputTensors": [
		{
			"shape": [
				1,
				3,
				416,
				416
			],
			"dataKind": "ImageRgbChw",
			"valueType": "Float32",
			"std": [
				0.0039215686,
				0.0039215686,
				0.0039215686
			]
		}
	]
}
