{
  "version": "1.0.0",
  "name": "ultraface-rfb-320-fp32-source",
  "modelFile": "source.onnx",
  "hfDownload": {
    "repo_id": "Arm/ultraface-rfb-320-onnx-raspberry",
    "revision": "dd894b3db6ac5ac2bcff20e5cab96b40a4402855",
    "filename": "ultraface-rfb-320_raspberry_onnx_original.onnx",
    "sha256": "360f8c2d9c070f0a8d28b2bf6b3a3ec5ad69625618796f049908522e2275cd4a"
  },
  "dynamicOutput": false,
  "inputTensors": [{"shape": [1, 3, 240, 320], "dataKind": "ImageRgbChw", "valueType": "Float32"}],
  "outputTensors": [
    {"shape": [1, 4420, 2], "dataKind": "RawTensorData", "valueType": "Float32"},
    {"shape": [1, 4420, 4], "dataKind": "RawTensorData", "valueType": "Float32"}
  ]
}
