{
  "version": "1.0.1",
  "name": "mlwl-classifier",
  "modelFile": "classifier.vgf",
  "dynamicOutput": false,
  "contentType": "classification",
  "inputTensors": [
    {
      "shape": [1, 3, 224, 224],
      "dataKind": "ImageRgbChw",
      "valueType": "Float32",
      "mean": [0.485, 0.456, 0.406],
      "std": [0.229, 0.224, 0.225]
    }
  ],
  "outputTensors": [
    {
      "shape": [1, 1001],
      "dataKind": "RawTensorData",
      "valueType": "Float32"
    }
  ]
}
