{
  "version": "1.0.1",
  "name": "yolo26s-640-int8",
  "modelFile": "yolo26s_raspberry_onnx_optimized.onnx",
  "hfDownload": {
    "repo_id": "Arm/yolo26s-640-int8-onnx-raspberrypi5",
    "revision": "7ec6a1e0269ef93063dca29805933c632637049b",
    "filename": "yolo26s_raspberry_onnx_optimized.onnx",
    "sha256": "2f5e6e8cd8ee745bc39ab574e7faaf5a334e6993ab12f5a01e2a90c81e635f1c"
  },
  "dynamicOutput": true,
  "inputTensors": [
    {
      "shape": [
        1,
        3,
        640,
        640
      ],
      "dataKind": "ImageRgbChw",
      "keepAspectRatio": true,
      "letterboxRed": 0.4470588235294118,
      "letterboxGreen": 0.4470588235294118,
      "letterboxBlue": 0.4470588235294118
    }
  ]
}

