{
  "version": "1.1.0",
  "name": "smart-turn",
  "legal": "https://huggingface.co/soniqo/Smart-Turn-v3.2-ONNX",
  "modelFile": "smart-turn-v3.2-int8.onnx",
  "hfDownload": {
    "repo_id": "soniqo/Smart-Turn-v3.2-ONNX",
    "revision": "b48fdbe20772bcec1fef02f4a1a355236ef6359e",
    "filename": "smart-turn-v3.2-int8.onnx",
    "sha256": "00cd131551e8d1e9011f31345edb632a26116dd83e159782c4ddff610718ea31"
  },
  "dynamicOutput": false,
  "contentType": "turnDetection",
  "inputTensors": [
    {
      "shape": [
        1,
        128000
      ],
      "dataKind": "AudioPcm",
      "valueType": "Float32"
    }
  ],
  "outputTensors": [
    {
      "shape": [
        1,
        1
      ],
      "dataKind": "RawTensorData",
      "valueType": "Float32"
    }
  ]
}
