{
  "version": "1.0.0",
  "name": "yolo26n-320-fp32-source",
  "modelFile": "source.onnx",
  "hfDownload": {
    "repo_id": "Arm/yolo26n-320-int8-onnx-raspberrypi5",
    "revision": "d85636720c31b6bc65d91b2c785d24fbdb283a61",
    "filename": "yolo26n_raspberry_onnx_original.onnx",
    "sha256": "d38ee776e79832560a35875d8962e8ff737f9ea1274d54b785fda2861d7b8ef2"
  },
  "dynamicOutput": true,
  "inputTensors": [{"shape": [1, 3, 320, 320], "dataKind": "ImageRgbChw", "valueType": "Float32"}]
}
