{
  "version": "1.0.1",
  "name": "nitec-resnet-18-int8",
  "modelFile": "cam_contact_nitec_rs18-a8w8-ort-quantized.onnx",
  "hfDownload": {
    "repo_id": "Arm/nitec-resnet-18-int8-onnx",
    "revision": "12cb65f9696e7ed620e59d38ed7002df99378724",
    "filename": "cam_contact_nitec_rs18-a8w8-ort-quantized.onnx",
    "sha256": "eff8cfcce4ebdbdab68ad338c67c5608ffaf856808e5739b4289e5e7ddd7366d"
  },
  "dynamicOutput": false,
  "contentType": "cameraContact",
  "inputTensors": [{"shape": [1, 3, 224, 224], "dataKind": "ImageRgbChw", "valueType": "Float32", "mean": [0.485, 0.456, 0.406], "std": [0.229, 0.224, 0.225]}],
  "outputTensors": [{"shape": [1, 2], "dataKind": "RawTensorData", "valueType": "Float32"}]
}

