{
	"version": "1.0.0",
	"name": "yolo-objdet",
	"modelFile": "yolo11n-fp32-320.onnx",
	"hfDownload": {
		"repo_id": "giangndm/yolo11-onnx",
		"revision": "8b180c762d5cf217886d16e64403508042207e4d",
		"filename": "yolo11n_320.onnx",
		"sha256": "ed25687f7f3176a041bcdd0173501629afcaaddf37711f2294ced377f249fd65"
	},
	"dynamicOutput": true,
	"inputTensors": [
		{
			"shape": [
				1,
				3,
				320,
				320
			],
			"dataKind": "ImageRgbChw",
			"keepAspectRatio": true,
			"letterboxRed": 0.44705883,
			"letterboxGreen": 0.44705883,
			"letterboxBlue": 0.44705883
		}
	]
}
