{
  "version": "1.0.1",
  "name": "yolo26n-480-int8",
  "modelFile": "yolo26n_raspberry_onnx_optimized.onnx",
  "hfDownload": {
    "repo_id": "Arm/yolo26n-480-int8-onnx-raspberrypi5",
    "revision": "bbe0e8adbbf3fbd64be5a586ed337525e0a1d7d4",
    "filename": "yolo26n_raspberry_onnx_optimized.onnx",
    "sha256": "6b5c40cd928ed7f82e91b400a32bceb7508b86bc3342bc6c1b7c4874f9d16146"
  },
  "dynamicOutput": true,
  "inputTensors": [
    {
      "shape": [
        1,
        3,
        480,
        480
      ],
      "dataKind": "ImageRgbChw",
      "keepAspectRatio": true,
      "letterboxRed": 0.4470588235294118,
      "letterboxGreen": 0.4470588235294118,
      "letterboxBlue": 0.4470588235294118
    }
  ]
}

