{
  "version": "1.0.1",
  "name": "yolo26s-480-int8",
  "modelFile": "yolo26s_raspberry_onnx_optimized.onnx",
  "hfDownload": {
    "repo_id": "Arm/yolo26s-480-int8-onnx-raspberrypi5",
    "revision": "97e0e565e3277c76932924abc351ec6337e57037",
    "filename": "yolo26s_raspberry_onnx_optimized.onnx",
    "sha256": "a5a14dfba0afe17988b73c10776c5aa0658d32b327cdbb39823a2d2a849fd182"
  },
  "dynamicOutput": true,
  "inputTensors": [
    {
      "shape": [
        1,
        3,
        480,
        480
      ],
      "dataKind": "ImageRgbChw",
      "keepAspectRatio": true,
      "letterboxRed": 0.4470588235294118,
      "letterboxGreen": 0.4470588235294118,
      "letterboxBlue": 0.4470588235294118
    }
  ]
}

