{
	"version": "1.0.0",
	"name": "person-class",
	"modelFile": "tf_mobilenetv1_float_model.onnx",
	"hfDownload": {
		"repo_id": "Arm/PersonClassification",
		"revision": "274b98c0419ecaf7c665cc2a03e8f792632bad08",
		"filename": "tf_mobilenetv1_float_model.onnx"
	},
	"dynamicOutput": true,
	"inputTensors": [
		{
			"shape": [
				1,
				96,
				96,
				3
			],
			"dataKind": "ImageRgbHwc",
			"valueType": "Float32",
			"mean": [0.0, 0.0, 0.0],
			"std": [0.0039215686, 0.0039215686, 0.0039215686]
		}
	]
}
