{
  "version": "1.0.0",
  "name": "yolo26n-sem",
  "modelFile": "yolo26n-sem.onnx",
  "dynamicOutput": false,
  "contentType": "semanticSegmentation",
  "inputTensors": [
    {
      "shape": [1, 3, 1024, 1024],
      "dataKind": "ImageRgbChw",
      "valueType": "Float32",
      "keepAspectRatio": true,
      "letterboxRed": 0.4470588235294118,
      "letterboxGreen": 0.4470588235294118,
      "letterboxBlue": 0.4470588235294118
    }
  ],
  "outputTensors": [
    {
      "shape": [1, 1024, 1024],
      "dataKind": "RawTensorData",
      "valueType": "Uint8"
    }
  ]
}
